{
  "schemaVersion": "neo.skill-draft/v1",
  "sourceRunId": "run_0123456789abcdef",
  "sourceSnapshotId": "snapshot_0123456789abcdef",
  "sourceSnapshotFingerprint": "sha256:aaaaaaaaaaaaaaaaaaaaaaaaaaaaaaaaaaaaaaaaaaaaaaaaaaaaaaaaaaaaaaaa",
  "basePackageFingerprint": "sha256:1111111111111111111111111111111111111111111111111111111111111111",
  "proposedPackageFingerprint": "sha256:3333333333333333333333333333333333333333333333333333333333333333",
  "runtimeBundleFingerprint": "sha256:2222222222222222222222222222222222222222222222222222222222222222",
  "sbomFingerprint": "sha256:4444444444444444444444444444444444444444444444444444444444444444",
  "archiveFingerprint": "sha256:5555555555555555555555555555555555555555555555555555555555555555",
  "evidenceFingerprint": "sha256:6666666666666666666666666666666666666666666666666666666666666666",
  "testFingerprint": "sha256:7777777777777777777777777777777777777777777777777777777777777777",
  "name": "repository-audit",
  "version": "1.2.4",
  "archiveBytes": 8192,
  "evidence": [
    {
      "kind": "source_package",
      "ref": "sha256:1111111111111111111111111111111111111111111111111111111111111111",
      "fingerprint": "sha256:1111111111111111111111111111111111111111111111111111111111111111",
      "paths": ["*"]
    },
    {
      "kind": "run_event",
      "ref": "event_0123456789abcdef",
      "fingerprint": "sha256:8888888888888888888888888888888888888888888888888888888888888888",
      "paths": ["SKILL.md", "neo.runtime.json", "tests/learning_test.go"]
    }
  ],
  "tests": [
    {
      "path": "tests/learning_test.go",
      "size": 512,
      "fingerprint": "sha256:9999999999999999999999999999999999999999999999999999999999999999"
    }
  ],
  "changedPaths": ["SKILL.md", "neo.runtime.json", "tests/learning_test.go"]
}
